{
  "contract_version": "issue-intake-report/v1",
  "issues": [
    {
      "number": 187,
      "queued": true,
      "recommendation": "ALREADY_QUEUED",
      "repository": "masa-san-jp/agentic-art-orchestration",
      "ssot": {
        "human_gate": false,
        "missing": [
          "observable_acceptance",
          "human_gate"
        ],
        "observable_acceptance": false,
        "qualified": false,
        "target_repository": true,
        "verification_commands": true
      },
      "title": "fix: PLAN_READY制作プランを設定済みpublic projectへ自動出力する",
      "url": "https://github.com/masa-san-jp/agentic-art-orchestration/issues/187"
    },
    {
      "number": 190,
      "queued": false,
      "recommendation": "REGISTER_BACKLOG",
      "repository": "masa-san-jp/agentic-art-orchestration",
      "ssot": {
        "human_gate": true,
        "missing": [],
        "observable_acceptance": true,
        "qualified": true,
        "target_repository": true,
        "verification_commands": true
      },
      "title": "docs: agentic-art-projectを正規の公開成果物repoとして定義する",
      "url": "https://github.com/masa-san-jp/agentic-art-orchestration/issues/190"
    },
    {
      "number": 213,
      "queued": false,
      "recommendation": "REGISTER_BACKLOG",
      "repository": "masa-san-jp/agentic-art-orchestration",
      "ssot": {
        "human_gate": true,
        "missing": [],
        "observable_acceptance": true,
        "qualified": true,
        "target_repository": true,
        "verification_commands": true
      },
      "title": "feat: clone/fork向けrepo-local .agentic-art出力境界へ移行する",
      "url": "https://github.com/masa-san-jp/agentic-art-orchestration/issues/213"
    },
    {
      "number": 217,
      "queued": false,
      "recommendation": "REGISTER_BACKLOG",
      "repository": "masa-san-jp/agentic-art-orchestration",
      "ssot": {
        "human_gate": true,
        "missing": [],
        "observable_acceptance": true,
        "qualified": true,
        "target_repository": true,
        "verification_commands": true
      },
      "title": "fix: Research完了の誤報告を防ぎ、ProductionレビューからProject納品まで自律完走する",
      "url": "https://github.com/masa-san-jp/agentic-art-orchestration/issues/217"
    }
  ],
  "queue": {
    "path": "execution/task-queue.yaml",
    "queued_issue_urls": [
      "https://github.com/masa-san-jp/agentic-art-orchestration/issues/1",
      "https://github.com/masa-san-jp/agentic-art-orchestration/issues/100",
      "https://github.com/masa-san-jp/agentic-art-orchestration/issues/101",
      "https://github.com/masa-san-jp/agentic-art-orchestration/issues/102",
      "https://github.com/masa-san-jp/agentic-art-orchestration/issues/103",
      "https://github.com/masa-san-jp/agentic-art-orchestration/issues/104",
      "https://github.com/masa-san-jp/agentic-art-orchestration/issues/105",
      "https://github.com/masa-san-jp/agentic-art-orchestration/issues/107",
      "https://github.com/masa-san-jp/agentic-art-orchestration/issues/109",
      "https://github.com/masa-san-jp/agentic-art-orchestration/issues/110",
      "https://github.com/masa-san-jp/agentic-art-orchestration/issues/113",
      "https://github.com/masa-san-jp/agentic-art-orchestration/issues/114",
      "https://github.com/masa-san-jp/agentic-art-orchestration/issues/115",
      "https://github.com/masa-san-jp/agentic-art-orchestration/issues/116",
      "https://github.com/masa-san-jp/agentic-art-orchestration/issues/117",
      "https://github.com/masa-san-jp/agentic-art-orchestration/issues/124",
      "https://github.com/masa-san-jp/agentic-art-orchestration/issues/141",
      "https://github.com/masa-san-jp/agentic-art-orchestration/issues/148",
      "https://github.com/masa-san-jp/agentic-art-orchestration/issues/149",
      "https://github.com/masa-san-jp/agentic-art-orchestration/issues/150",
      "https://github.com/masa-san-jp/agentic-art-orchestration/issues/176",
      "https://github.com/masa-san-jp/agentic-art-orchestration/issues/187",
      "https://github.com/masa-san-jp/agentic-art-orchestration/issues/189",
      "https://github.com/masa-san-jp/agentic-art-orchestration/issues/193",
      "https://github.com/masa-san-jp/agentic-art-orchestration/issues/194",
      "https://github.com/masa-san-jp/agentic-art-orchestration/issues/195",
      "https://github.com/masa-san-jp/agentic-art-orchestration/issues/196",
      "https://github.com/masa-san-jp/agentic-art-orchestration/issues/197",
      "https://github.com/masa-san-jp/agentic-art-orchestration/issues/2",
      "https://github.com/masa-san-jp/agentic-art-orchestration/issues/203",
      "https://github.com/masa-san-jp/agentic-art-orchestration/issues/214",
      "https://github.com/masa-san-jp/agentic-art-orchestration/issues/43",
      "https://github.com/masa-san-jp/agentic-art-orchestration/issues/47",
      "https://github.com/masa-san-jp/agentic-art-orchestration/issues/56",
      "https://github.com/masa-san-jp/agentic-art-orchestration/issues/58",
      "https://github.com/masa-san-jp/agentic-art-orchestration/issues/67",
      "https://github.com/masa-san-jp/agentic-art-orchestration/issues/68",
      "https://github.com/masa-san-jp/agentic-art-orchestration/issues/70",
      "https://github.com/masa-san-jp/agentic-art-orchestration/issues/71",
      "https://github.com/masa-san-jp/agentic-art-orchestration/issues/84",
      "https://github.com/masa-san-jp/agentic-art-orchestration/issues/85",
      "https://github.com/masa-san-jp/agentic-art-orchestration/issues/91",
      "https://github.com/masa-san-jp/agentic-art-orchestration/issues/98",
      "https://github.com/masa-san-jp/agentic-art-orchestration/issues/99",
      "https://github.com/masa-san-jp/agentic-art-production/issues/10",
      "https://github.com/masa-san-jp/agentic-art-production/issues/34",
      "https://github.com/masa-san-jp/agentic-art-production/issues/36",
      "https://github.com/masa-san-jp/agentic-art-production/issues/52",
      "https://github.com/masa-san-jp/agentic-art-production/issues/54",
      "https://github.com/masa-san-jp/agentic-art-production/issues/58",
      "https://github.com/masa-san-jp/agentic-art-production/issues/61",
      "https://github.com/masa-san-jp/agentic-art-production/issues/62",
      "https://github.com/masa-san-jp/agentic-art-project/issues/10",
      "https://github.com/masa-san-jp/agentic-art-research/issues/45",
      "https://github.com/masa-san-jp/agentic-art-research/issues/47",
      "https://github.com/masa-san-jp/agentic-art-research/issues/48",
      "https://github.com/masa-san-jp/agentic-art-research/issues/49",
      "https://github.com/masa-san-jp/agentic-art-research/issues/83",
      "https://github.com/masa-san-jp/agentic-art-research/issues/85",
      "https://github.com/masa-san-jp/agentic-art-research/issues/89",
      "https://github.com/masa-san-jp/agentic-art-research/issues/91",
      "https://github.com/masa-san-jp/agentic-art-research/issues/93",
      "https://github.com/masa-san-jp/agentic-art-research/issues/94",
      "https://github.com/masa-san-jp/art-history-notes/issues/386",
      "https://github.com/masa-san-jp/marketing-trends-notes/issues/86",
      "https://github.com/masa-san-jp/self-model-notes/issues/40",
      "https://github.com/masa-san-jp/self-model-notes/issues/83",
      "https://github.com/masa-san-jp/self-model-notes/issues/93",
      "https://github.com/masa-san-jp/viewer-response-notes/issues/4",
      "https://github.com/masa-san-jp/viewer-response-notes/issues/6"
    ],
    "sha256": "632347f46cd154cfebb35fb9ea7b5533c68e50f29e398a557d5a319dce72c70d"
  },
  "source": {
    "kind": "live",
    "locator": "gh issue list",
    "observed_at": "2026-09-10T00:00:00Z"
  },
  "summary": {
    "qualified_unqueued": 3,
    "queued": 1,
    "total": 4,
    "unqueued_needs_ssot": 0
  }
}
